{"$schema":"https://json-schema.org/draft/2020-12/schema","type":"object","additionalProperties":false,"required":["as_of","parameters","data_contract","dataset_refs","records"],"properties":{"as_of":{"type":"string","format":"date"},"parameters":{"type":"object","additionalProperties":false,"required":["category","top_n","targets","metric_weights"],"properties":{"category":{"type":"string","minLength":1,"maxLength":4096},"top_n":{"type":"integer","minimum":1,"maximum":50},"targets":{"$ref":"#/$defs/metrics"},"metric_weights":{"$ref":"#/$defs/positive_metrics"}}},"data_contract":{"$ref":"#/$defs/data_contract"},"dataset_refs":{"$ref":"#/$defs/dataset_refs"},"source_hashes":{"$ref":"#/$defs/source_hashes"},"records":{"type":"array","minItems":1,"maxItems":50,"items":{"type":"object","additionalProperties":false,"required":["fund_code","name","category","as_of","annual_return_pct","max_drawdown_pct","volatility_pct","expense_ratio_pct","manager_tenure_years"],"properties":{"fund_code":{"type":"string","minLength":1,"maxLength":4096},"name":{"type":"string","minLength":1,"maxLength":4096},"category":{"type":"string","minLength":1,"maxLength":4096},"as_of":{"type":"string","format":"date"},"annual_return_pct":{"type":"number"},"max_drawdown_pct":{"type":"number"},"volatility_pct":{"type":"number"},"expense_ratio_pct":{"type":"number"},"manager_tenure_years":{"type":"number"}}}}},"$defs":{"metrics":{"type":"object","additionalProperties":false,"required":["annual_return_pct","max_drawdown_pct","volatility_pct","expense_ratio_pct","manager_tenure_years"],"properties":{"annual_return_pct":{"type":"number"},"max_drawdown_pct":{"type":"number"},"volatility_pct":{"type":"number"},"expense_ratio_pct":{"type":"number"},"manager_tenure_years":{"type":"number"}}},"positive_metrics":{"type":"object","additionalProperties":false,"required":["annual_return_pct","max_drawdown_pct","volatility_pct","expense_ratio_pct","manager_tenure_years"],"properties":{"annual_return_pct":{"type":"number","exclusiveMinimum":0},"max_drawdown_pct":{"type":"number","exclusiveMinimum":0},"volatility_pct":{"type":"number","exclusiveMinimum":0},"expense_ratio_pct":{"type":"number","exclusiveMinimum":0},"manager_tenure_years":{"type":"number","exclusiveMinimum":0}}},"data_contract":{"type":"object","additionalProperties":false,"required":["provider","mapping_id","mapping_version","units","date_semantics","adjustment"],"properties":{"provider":{"enum":["synthetic","datahub","user_input"]},"mapping_id":{"const":"fund-matcher"},"mapping_version":{"const":"1.0.0"},"units":{"type":"object","additionalProperties":false,"required":["return","drawdown","volatility","expense_ratio","tenure","score"],"properties":{"return":{"const":"percent"},"drawdown":{"const":"percent"},"volatility":{"const":"percent"},"expense_ratio":{"const":"percent"},"tenure":{"const":"years"},"score":{"const":"0_to_100"}}},"date_semantics":{"const":"fund_metrics_as_of"},"adjustment":{"const":"not_applicable"}}},"dataset_refs":{"type":"array","minItems":1,"maxItems":32,"items":{"$ref":"#/$defs/dataset_ref"}},"dataset_ref":{"type":"object","additionalProperties":false,"required":["dataset_id","provider_id","as_of","sha256"],"properties":{"dataset_id":{"type":"string","minLength":1,"maxLength":4096},"provider_id":{"enum":["synthetic","datahub","user_input"]},"as_of":{"type":"string","format":"date"},"sha256":{"type":"string","pattern":"^[0-9a-fA-F]{64}$"}}},"source_hashes":{"type":"object","maxProperties":32,"propertyNames":{"type":"string","minLength":1,"pattern":"^(?!.*[\\r\\n\\u2028\\u2029])\\S(?:.*\\S)?$"},"additionalProperties":{"type":"string","pattern":"^[0-9a-fA-F]{64}$"}}}}
