{"as_of":"2026-09-15","parameters":{"category":"equity","top_n":2,"targets":{"annual_return_pct":10,"max_drawdown_pct":-10,"volatility_pct":15,"expense_ratio_pct":1,"manager_tenure_years":5},"metric_weights":{"annual_return_pct":2,"max_drawdown_pct":2,"volatility_pct":1,"expense_ratio_pct":1,"manager_tenure_years":1}},"data_contract":{"provider":"synthetic","mapping_id":"fund-matcher","mapping_version":"1.0.0","units":{"return":"percent","drawdown":"percent","volatility":"percent","expense_ratio":"percent","tenure":"years","score":"0_to_100"},"date_semantics":"fund_metrics_as_of","adjustment":"not_applicable"},"dataset_refs":[{"dataset_id":"fixture-fund-matcher","provider_id":"synthetic","as_of":"2026-09-15","sha256":"7374a9c1232e76a42babe9cf26ab2187f12bc328cc385163cefa7ed26f3ba7b2"}],"source_hashes":{"synthetic":"7374a9c1232e76a42babe9cf26ab2187f12bc328cc385163cefa7ed26f3ba7b2"},"records":[{"fund_code":"FUND-B","name":"基金乙","category":"equity","as_of":"2026-09-15","annual_return_pct":8,"max_drawdown_pct":-14,"volatility_pct":18,"expense_ratio_pct":0.8,"manager_tenure_years":4},{"fund_code":"FUND-A","name":"基金甲","category":"equity","as_of":"2026-09-15","annual_return_pct":11,"max_drawdown_pct":-9,"volatility_pct":14,"expense_ratio_pct":1.2,"manager_tenure_years":6},{"fund_code":"FUND-C","name":"基金丙","category":"bond","as_of":"2026-09-15","annual_return_pct":6,"max_drawdown_pct":-3,"volatility_pct":4,"expense_ratio_pct":0.5,"manager_tenure_years":8}]}
